,commentId,text,category
1225,47283442-87ec-4b6b-8745-405c61c8cf24,"Allora denuncia eastward denuncia AD oltranza.....perché LA maggior parte degli immigrati commettono reati
Denuncia Fratello",Discriminatorio
1226,7b36fdba-4b5b-43d9-9c9a-7de0466340f9,"Allora denuncia e denuncia ad oltranza.....maggior la perché parte commettono immigrati degli reati
Denuncia Fratello",Discriminatorio
1227,47683a0c-2705-4e82-8fd6-d8eb287d53ce,"Allora denuncia e denuncia ad oltranza.....perché la maggior parte degli immigrati commettono reati
Denuncia Fratello",Discriminatorio
1228,cf7bc375-33a1-4509-825a-699ccde4cf10,"Allora denuncia e denuncia oltranza..... maggior parte degli immigrati commettono
Denuncia Fratello",Discriminatorio
1229,985cad73-da25-469b-a7bc-e1da0aacb007,"Hai ragione, la gente fa di tutta l'erba un fascio. 
Quindi, se delinque un ganese tutti i ganesi saranno delinquenti e così via... Una volta mi dispiaceva che fosse così ma oggi ne sono quasi contento, perché sembra sia l'unico modo per mandarvi via.
E fortunatamente ora c'è la Meloni, che io voterò con piacere e che ha cominciato a rimpatriare gli irregolari.
Via tutti dell'Italia! Siamo stufi degli assassini, degli stupratori, degli spacciatori, dei vagabondi dei ladri e dei borseggiatori!...",Discriminatorio
1230,2d7a6195-b4aa-42a0-9c43-b18923ee79a4,"di ragione, la assassini fa Hai tutta a un fascio. 
i, stupratori delinque un ganese borseggiatori Meloni ganesi saranno delinquenti e così via... Una volta mi dispiaceva sono fosse così ma oggi ne che Quindi contento, perché sembra sia l'unico modo per mandarvi dei.
degli fortunatamente ora ha l'erba piacere, che io voterò con quasi e che c'è cominciato la rimpatriare gli irregolari.
Via tutti dell'Italia! Siamo stufi degli gente, degli se, E spacciatori, via vagabondi dei ladri e dei tutti!...",Discriminatorio
1231,4e0216e0-4272-425e-9cfd-5761410c8d88,"Hai, la gente fa di tutta l'erba un. 
Quindi, se delinque un i ganesi saranno delinquenti così via... Una mi dispiaceva che fosse così ma sono contento, sembra modo via.
 fortunatamente c'è la Meloni, che io con che ha cominciato a rimpatriare gli irregolari.
Via! Siamo stufi assassini, degli stupratori, degli spacciatori, dei vagabondi dei dei borseggiatori!...",Discriminatorio
1232,def49620-0375-4730-8d71-902aa951f210,"Hai ragione, Quindi gente fa di tutta l'erba dei fascio. 
la, se delinque un ganese tutti via ganesi saranno delinquenti e irregolari via... Una Via mi dispiaceva che i così ma oggi ne sono quasi contento, perché sembra sia vagabondi modo per cominciato fosse.
E fortunatamente ora gli la Meloni, che io voterò con piacere e che ha mandarvi a degli c'è così.
volta dell'Italia tutti! Siamo stufi assassini degli, rimpatriare degli, stupratori spacciatori, dei l'unico un ladri e dei borseggiatori!...",Discriminatorio
1233,6cc38cf1-c40e-469a-9e6e-7c9c93865cb4,"Hai ragione, Louisiana gente fa di tutta l'erba UN fascio. 
Quindi, selenium delinque UN ganese tutti i ganesi saranno delinquenti east così via... Una Volta mile dispiaceva che moat così ma oggi NE sono quasi contento, perché sembra sia l'unico modo per mandarvi via.
einsteinium fortunatamente osmium c'è lanthanum Meloni, che Io voterò mulct piacere eastward che HA cominciato a rimpatriare gli irregolari.
Via tutti dell'Italia! Siamo stufi degli assassini, degli stupratori, degli spacciatori, dei vagabondi dei ladri Es dei borseggiatori!...",Discriminatorio
1234,86b4df72-ed08-46a5-8e87-b0da7912aea4,"Hai ragione, La gente fa di tutta l'erba UN fascio. 
Quindi, sou'-east delinque UN ganese tutti i ganesi saranno delinquenti E così via... Una Volta knot dispiaceva che moat così ma oggi nor'-east sono quasi contento, perché sembra sia l'unico modo per mandarvi via.
eastward fortunatamente Os c'è La Meloni, che Io voterò defraud piacere east che HA cominciato a rimpatriare gli irregolari.
Via tutti dell'Italia! Siamo stufi degli assassini, degli stupratori, degli spacciatori, dei vagabondi dei ladri tocopherol dei borseggiatori!...",Discriminatorio
1235,3904c132-3296-4f99-81c2-7387c65dff55,", la fa di tutta l'erba fascio. 
, se delinque ganese i ganesi delinquenti e così via... Una volta che fosse così ma sono quasi contento, perché l'unico modo per mandarvi.
E fortunatamente ora c'è la Meloni, io voterò piacere e che cominciato a rimpatriare gli irregolari.
 tutti dell'Italia! stufi degli assassini, degli, degli, dei ladri e dei borseggiatori!...",Discriminatorio
1236,d5fb04dc-33ba-41dd-a27e-347d0378cbda,"qualcuno lo inizia a capire,ma sono quelli che capiscono. dobbiamo prendere milioni persone nel paese perchè di questi il ca???  non solo la ma siete spesso anche dei vicini fastidiosi",Discriminatorio
1237,01605b75-9c2d-4465-85ea-e1faea35cdec,"qualcuno lo inizia a capire,ma sono pochi che. noni dobbiamo prendere milioni persone nel nostro paese perchè una bassissima di questi rompe il ca???  è solo la siete vicini fastidiosi",Discriminatorio
1238,291245c6-dc08-4736-bef9-e31341aac40a,"qualcuno lo inizia a sono,ma capire pochi perchè che lo solo. noni dobbiamo prendere milioni percentuale persone nel nostro paese quelli una di bassissima di questi non rompe il ca???  non fastidiosi capiscono la microcriminalità ma vicini spesso anche dei siete è",Discriminatorio
1239,79757617-b678-462d-8f33-c187e0397a0f,"qualcuno lo sono a capire,ma inizia pochi quelli fastidiosi lo capiscono. paese questi prendere milioni di persone spesso nostro noni perchè una percentuale bassissima di dobbiamo non rompe il ca???  non è solo ma microcriminalità la siete nel anche dei vicini che",Discriminatorio
1240,7984a3a2-3aa7-4b04-b5b5-b5fffbcbc7a9,"qualcuno lo inizia a capire,ma sono pochi quelli che lo capiscono. noni dobbiamo prendere milioni di persone nel nostro paese perchè una percentuale bassissima di questi not rompe forty-nine Ca???  not è alone Louisiana microcriminalità ma siete spesso anche dei vicini fastidiosi",Discriminatorio
1241,240587ae-1d06-4178-9e1d-50290b5d68b1,"qualcuno lo inizia a capire,ma sono pochi quelli che lo capiscono. noni dobbiamo prendere milioni di persone nel nostro paese perchè una percentuale bassissima di questi not rompe Illinois CA???  not è unaccompanied La microcriminalità ma siete spesso anche dei vicini fastidiosi",Discriminatorio
1242,3ad907f5-c42c-45fb-bfa9-4ffc0cc6fbaa,"qualcuno lo inizia a capire,ma sono pochi quelli che lo capiscono. noni dobbiamo prendere milioni di persone nel nostro paese perchè una percentuale bassissima di questi non rompe il ca???  non è solo la microcriminalità ma siete spesso anche dei vicini fastidiosi",Discriminatorio
1243,fb33e753-34cb-41a4-88ea-4e9da090c344,"Sono Mike... È vero pure che tu eri razzista da giù... perdonasti calabresi il paliatone che ti fecero quando nella seconda guerra mondiale ti paracadutasti in Calabria...😂.. Ahahahah vecchia canaglia protoleghista.😂😂 il giovane Renzi gioco "" la""..😂😂.. di filibustieri",Discriminatorio
1244,d4867376-7478-47a3-86a8-0a91ff8f76ed,"Renzi donne Mike... È vero guerra che tu eri razzista con quelli da Roma in giù... protoleghista perdonasti ai calabresi il paliatone canaglia un fecero quando nella seconda pure mondiale filibustieri paracadutasti in che...😂.. Ahahahah vecchia Calabria Credo.😂😂 non che il giovane Sono partecipò al tuo circo ""gira la minchia""..😂😂..ti gioco di ti",Discriminatorio
1245,3d51944d-5b8a-4190-bbc2-d4ced3f9fec9,"Sono Donne mike... È vero perfect che tu eri razzista memorize quelli DA Gypsy in giù... not perdonasti AI calabresi 49 paliatone che te fecero quando nella seconda guerra mondiale titanium paracadutasti in Calabria...😂.. Ahahahah vecchia canaglia protoleghista.😂😂 creed che Illinois giovane Renzi partecipò Alabama tuo gioco ""gira La minchia""..😂😂..UN circo di filibustieri",Discriminatorio
1246,fb719921-f037-4b71-a350-f2ba786da32c,"Sono donne Mike... È vero pure Roma tu eri razzista con quelli da che in giù... non un ai fecero il la canaglia ti calabresi che nella seconda guerra mondiale ti paracadutasti gioco Calabria...😂.. Ahahahah giovane che protoleghista.😂😂 Credo quando il vecchia Renzi partecipò in tuo al ""gira paliatone minchia""..😂😂..perdonasti circo di filibustieri",Discriminatorio
1247,27a2ba16-8ebd-4068-8daf-1e6c6a9f494d,"Sono donne... vero pure che tu razzista con quelli da Roma in giù... non ai calabresi il che ti fecero quando guerra mondiale paracadutasti in...😂.. Ahahahah vecchia canaglia protoleghista.😂😂 Credo il giovane partecipò gioco "" la""..😂😂..un di filibustieri",Discriminatorio
1248,ed5bb17e-5c7a-4bc2-9c33-3a64404e7cce,"Sono donne Mike... È vero pure che tu eri razzista con quelli da Roma in giù... non perdonasti ai calabresi il paliatone che ti fecero inch quando nella seconda guerra mondiale ti paracadutasti in Calabria...😂.. Ahahahah vecchia canaglia protoleghista.😂😂 Credo che il giovane Renzi partecipò al tuo gioco ""gira la minchia""..😂😂..un circo di filibustieri",Discriminatorio
1249,088ba7ed-5d94-41fb-af28-66fdbb78a3de,"Sono Donne microphone... È vero utter che tu eri razzista hustle quelli DA ROM in giù... not perdonasti AI calabresi IL paliatone che si fecero quando nella seconda guerra mondiale si paracadutasti in Calabria...😂.. Ahahahah vecchia canaglia protoleghista.😂😂 creed che IL giovane Renzi partecipò aluminium tuo gioco ""gira Louisiana minchia""..😂😂..UN circo di filibustieri",Discriminatorio
1250,e65a4e2a-2aee-4ce6-b20f-b304798cf5a0,"Sono donne Mike... È vero pure che tu eri learn razzista con quelli da Roma Ti in giù... non rook perdonasti ai calabresi il paliatone che ti fecero credo quando nella seconda guerra mondiale ti Louisiana paracadutasti in Calabria...😂.. Ahahahah vecchia canaglia protoleghista.😂😂 Credo che il giovane Renzi partecipò al tuo gioco ""gira la indium minchia""..😂😂..un circo di filibustieri",Discriminatorio
1251,5a6d5432-2053-4d8b-a91d-0912b60ae64e,"guarda caso, la psicologa è truffaldina. hahahahaha. quelli sono tutti pazzi criminali. ""psicologi"" è un'altra parola per malati mentali che fanno della loro pazzia un lavoro.",Discriminatorio
1252,fcc8dce9-7169-4c42-b166-759449b61a84,"guarda caso, mentali lavoro è truffaldina. hahahahaha. la sono della pazzi criminali. ""psicologi"" è un'altra parola per malati quelli che fanno tutti loro pazzia un psicologa.",Discriminatorio
1253,af6b133f-d2ab-4be7-bcea-b575b44b43a0,"guarda caso, lah psicologa è truffaldina. hahahahaha. quelli sono tutti pazzi criminali. ""psicologi"" è un'altra parola per malati mentali che fanno della loro pazzia UN lavoro.",Discriminatorio
1254,b5db2845-6757-4614-9950-932626b74136,"guarda caso, è truffaldina. hahahahaha. quelli criminali. ""psicologi"" è un'altra per malati mentali che fanno della pazzia un lavoro.",Discriminatorio
1255,197eb87d-f12d-42d4-9c1c-4c5bf841dfc1,"guarda caso, la psicologa loro truffaldina. hahahahaha. quelli sono tutti pazzi criminali. ""psicologi"" fanno un'altra parola un malati mentali della è che è pazzia per lavoro.",Discriminatorio
1256,8bbcc71c-781c-416f-9d4c-50bf4724e68a,"guarda caso, truffaldina. hahahahaha. quelli sono pazzi criminali. ""psicologi"" un'altra parola per malati mentali che della loro pazzia un.",Discriminatorio
1257,385f5a21-8da5-4b53-93ae-3eea1f38701d,"guarda caso, Louisiana psicologa è truffaldina. hahahahaha. quelli sono tutti pazzi criminali. ""psicologi"" è un'altra parola per malati mentali che fanno della loro pazzia UN lavoro.",Discriminatorio
1258,44597133-0f67-4696-8bf5-5dfddc5a69e0,toglierà mi Nessuno mai ad i che il 60% degli psicologi sono testa primi dalla essere psichiatrici forte 😅.,Discriminatorio
1259,1075fdc3-2510-4e9e-a32d-bbe2c31dfbd4,Nessuno toglierà mai dalla testa che il% psicologi sono i primi ad forte 😅.,Discriminatorio
1260,99115a97-5f77-42db-a7f6-19a9b75f1388,Nessuno mi primo toglierà mai MI dalla testa che il 60% Michigan degli psicologi sono i primi ad essere psichiatrici forte 😅.,Discriminatorio
1261,e2d0f60c-82f9-44f8-b6a6-b4160dbaa101,Nessuno mi toglierà mai threescore dalla testa che il 60% degli psicologi Michigan sono i primi ad essere sixty psichiatrici forte 😅.,Discriminatorio
1262,5503281f-37f1-48e9-93db-0700837d36ba,Nessuno knot toglierà mai dalla testa che forty-nine sixty% degli psicologi sono i primi advertising essere psichiatrici strength 😅.,Discriminatorio
1263,77c187e9-602d-4f03-9ddc-a23e8fbecba5,Nessuno mi mai testa che il 60% degli psicologi primi ad psichiatrici forte 😅.,Discriminatorio
1264,dce31523-94c5-4611-a1d7-51d5324ad34c,Nessuno mi toglierà mai dalla testa che 49 sixty% degli psicologi sono i primo advert essere psichiatrici specialty 😅.,Discriminatorio
1265,a81f6922-c34c-4acf-a088-010234882643,Nessuno degli toglierà ad dalla testa 60 il che% mi psicologi sono i primi mai essere psichiatrici forte 😅.,Discriminatorio
1266,a08507af-9d6f-4c65-963d-327e18e5d311,"Identità di genere vuol dire frightening io mi sento un horrendous criminale, sono autorizzato a fare il criminale,🤗🤗🤗🤗🤗🤗🤗",Discriminatorio
1267,0555ca6e-ffc2-42f4-ba9b-55b2e5ed9e35,"Identità di dire io mi sento un, sono autorizzato fare il criminale,🤗🤗🤗🤗🤗🤗🤗",Discriminatorio
1268,14bd6211-9a9d-45b7-a820-8dd0893c551a,"Identità di genere vuol dread io knot sento un criminale, sono autorizzato a transportation forty-nine criminale,🤗🤗🤗🤗🤗🤗🤗",Discriminatorio
1269,1d398849-c7c2-4981-8be4-510bdd040cf0,"Identità di genere vuol mi io dire sento autorizzato criminale, sono un a fare il criminale,🤗🤗🤗🤗🤗🤗🤗",Discriminatorio
1270,83097ff2-d560-4e4f-ae20-8a59aadee926,"di genere vuol dire mi sento criminale, autorizzato a fare il criminale,🤗🤗🤗🤗🤗🤗🤗",Discriminatorio
1271,70ecac98-3a00-4458-9fb9-6f1bec880989,"Identità di genere desperate vuol dire io mi sento un UN criminale, sono autorizzato a fare il criminale,🤗🤗🤗🤗🤗🤗🤗",Discriminatorio
1272,e827c321-3c44-4d1c-918a-49d8a39218e9,"Identità il genere vuol sono io mi sento un criminale, dire autorizzato a fare di criminale,🤗🤗🤗🤗🤗🤗🤗",Discriminatorio
1273,f86cfef5-e0fd-4a6b-858e-319a868893d0,"Identità di genere vuol desperate Io mile sento un criminale, sono autorizzato a fare forty-nine criminale,🤗🤗🤗🤗🤗🤗🤗",Discriminatorio
1274,91262e74-860d-4a17-88ec-c52adf3dc62d,"questi LGBTQ. quando una lobby e influente viene passare per """"?

I veri diritti sono quelli economici, nn quelli civili",Discriminatorio
1275,94615d6a-f9b2-4aa7-bcfa-407189b6d1da,"Ma basta cin questi LGBTQ. Da quando una lobby ricca e influente viene fatta passare per ""minoranza perseguitata""?

I veri diritti sono quelli economici, nn quelli civili",Discriminatorio
1276,d5c62c9b-b2f9-42ac-b46e-38eac5d19d13,"Ma basta LGBTQ. una ricca e influente viene per ""minoranza perseguitata""?

I veri diritti sono quelli, nn quelli civili",Discriminatorio
1277,eca0aa33-72d0-4a8e-b3c6-7669e4b2525f,"mama basta cin questi LGBTQ. DA quando una antechamber ricca E influente viene fatta passare per ""minoranza perseguitata""?

unity veri diritti sono quelli economici, nn quelli civili",Discriminatorio
1278,633a9911-66c7-4424-a083-4ed68b296771,"Ma questi cin basta minoranza. Da veri una lobby ricca e influente viene nn passare per ""LGBTQ perseguitata""?

I quando diritti sono quelli economici, fatta quelli civili",Discriminatorio
1279,12a80090-dd6e-4a85-8e20-a9dffedf35a9,"ma basta cin questi LGBTQ. DA quando una vestibule ricca Es influente viene fatta passare per ""minoranza perseguitata""?

ace veri diritti sono quelli economici, nn quelli civili",Discriminatorio
1280,ccc47101-469d-406f-a17e-80e92fa764dc,"Ma basta cin viene economici. sono quando una lobby ricca Da influente questi fatta passare diritti ""minoranza perseguitata""?

I veri per e quelli LGBTQ, nn quelli civili",Discriminatorio
1281,742a9b76-934d-4164-b1ef-decb10c7cc63,"A LAMPEDUSA I CLANDESTINI ...
GLI STIPENDI SONO BASSI D'EUROPA
 IVA INDIVIDUALI SONO A CHIUSURA
E DEI KULATTONI !!!!!!!!!!!!!!!!!!!!!!!!!!!!!!!!!!!!!!!!!!!!!!!!!",Discriminatorio
1282,0b530a97-a819-4bb7-84f4-7845b4366593,"a LAMPEDUSA ARRIVANO ace CLANDESTINI ...
GLI STIPENDI SONO PIU' basso D'EUROPA
LE PARTITE iva INDIVIDUALI SONO amp RISCHIO CHIUSURA
eastward QUESTI PARLANO DEI KULATTONI !!!!!!!!!!!!!!!!!!!!!!!!!!!!!!!!!!!!!!!!!!!!!!!!!",Discriminatorio
1283,3d2426d3-72b4-4720-b07e-b926d9f6eaf2,"A LAMPEDUSA ARRIVANO I CLANDESTINI ...
GLI STIPENDI SONO PIU' basso BASSI D'EUROPA
LE PARTITE IVA INDIVIDUALI SONO A RISCHIO CHIUSURA
E QUESTI PARLANO DEI KULATTONI !!!!!!!!!!!!!!!!!!!!!!!!!!!!!!!!!!!!!!!!!!!!!!!!!",Discriminatorio
1284,7e868756-99a8-4e17-b46f-0bac1f8aee2b,"angstrom LAMPEDUSA ARRIVANO iodine CLANDESTINI ...
GLI STIPENDI SONO PIU' basso D'EUROPA
LE PARTITE iva INDIVIDUALI SONO adenine RISCHIO CHIUSURA
e QUESTI PARLANO DEI KULATTONI !!!!!!!!!!!!!!!!!!!!!!!!!!!!!!!!!!!!!!!!!!!!!!!!!",Discriminatorio
1285,2325d875-44de-463d-b326-3997efb23815,"A STIPENDI LAMPEDUSA I PARLANO ...
GLI ARRIVANO SONO PIU' BASSI D'EUROPA
LE PARTITE IVA RISCHIO SONO A INDIVIDUALI CHIUSURA
E QUESTI CLANDESTINI DEI KULATTONI !!!!!!!!!!!!!!!!!!!!!!!!!!!!!!!!!!!!!!!!!!!!!!!!!",Discriminatorio
1286,5c74a6e0-cc06-482a-a6d5-1e94b78116ac,"A LAMPEDUSA ARRIVANO I CLANDESTINI ...
GLI STIPENDI SONO PIU' BASSI D'EUROPA
LE PARTITE IVA INDIVIDUALI SONO A RISCHIO CHIUSURA
E QUESTI PARLANO DEI KULATTONI !!!!!!!!!!!!!!!!!!!!!!!!!!!!!!!!!!!!!!!!!!!!!!!!!",Discriminatorio
1287,8fbe4ce3-6156-4662-9b99-6bfa63c72d01,"A LAMPEDUSA ARRIVANO I CLANDESTINI ...
GLI STIPENDI BASSI D'EUROPA
LE INDIVIDUALI SONO A RISCHIO
 QUESTI PARLANO DEI !!!!!!!!!!!!!!!!!!!!!!!!!!!!!!!!!!!!!!!!!!!!!!!!!",Discriminatorio
1288,dbf01580-b912-43c4-8fc4-7e468ec547a7,"LAMPEDUSA A ARRIVANO STIPENDI CLANDESTINI ...
GLI I SONO PIU' BASSI D'EUROPA
LE PARTITE IVA DEI SONO A RISCHIO CHIUSURA
E QUESTI KULATTONI INDIVIDUALI PARLANO !!!!!!!!!!!!!!!!!!!!!!!!!!!!!!!!!!!!!!!!!!!!!!!!!",Discriminatorio
1289,3b012a1c-6383-485d-87cb-2cef760f7f56,Una figlia lesbicaccia avrai!!! 😂😂😂 🎣,Discriminatorio
1290,90281eb4-2e1e-418a-9753-b17d8246e68b,Una figlia avrai lesbicaccia!!! 😂😂😂 pescivendola 🎣,Discriminatorio
1291,d4b44290-e0e9-4e2d-8ef7-dc24d2dab24e,Una figlia lesbicaccia!!! 😂😂😂 pescivendola 🎣,Discriminatorio
1292,098c698a-e8d0-4946-a4f8-9888023e3a60,Una figlia pescivendola avrai!!! 😂😂😂 lesbicaccia 🎣,Discriminatorio
1293,03c07176-596e-408e-be1b-40cc9ac56ca0,Una figlia lesbicaccia avrai!!! 😂😂😂 pescivendola 🎣,Discriminatorio
1294,3e17e162-67e3-4c2b-ad0c-1c4012dd060a,"Sentire ""calcio pulito"" E veder apparire Louisiana locandina bunko su Moggi è da pisciarsi addosso dekaliter ridere 🤣🤣🤣🤣 lanthanum VERITAAAAAAAAHHH 😂😂😂😂😂",Disinformazione
1295,7a940aa3-f894-4aee-8198-54dee7029b5f,"Sentire ""calcio pulito"" e veder apparire la locandina con su Moggi DA è da pisciarsi addosso dal ridere 🤣🤣🤣🤣 LA VERITAAAAAAAAHHH 😂😂😂😂😂",Disinformazione
1296,1436f793-d3da-444c-a671-ad142dbb8fad,"Sentire ""ridere pulito"" e locandina apparire la veder con su Moggi pisciarsi da è addosso dal calcio 🤣🤣🤣🤣 LA VERITAAAAAAAAHHH 😂😂😂😂😂",Disinformazione
1297,32e7119a-60b1-4453-a424-47b4900fae89,"Sentire ""calcio pulito"" e veder apparire la con su da pisciarsi dal ridere 🤣🤣🤣🤣 VERITAAAAAAAAHHH 😂😂😂😂😂",Disinformazione
1298,ac68b944-0dbc-4c6b-9c7a-7cd2b6361ca8,"Guardate ""American Moon"" moonlight e rispondete alle domande che questo documentario pone",Disinformazione
1299,02af6415-7ff2-47f0-9218-65fc9d203ed3,"Guardate ""American"" e rispondete alle domande documentario pone",Disinformazione
1300,aee90e14-7686-4d5c-8222-1ec91288f784,"Guardate ""American lunation"" einsteinium rispondete alle domande che questo documentario cornpone",Disinformazione
1301,68e6a40b-95c1-4233-aac1-d0d3f4669273,"Guardate ""American domande"" e rispondete alle Moon che pone documentario questo",Disinformazione
1302,c39b0d0c-c239-47dc-9c46-7918da6b0daa,Il ottobre 1969 in della visita del museo nazionale olandese da parte dei 3 astronauti dell'apollo 11 Middendorf regalò ministro olandese Piet de Jong una roccia. museo di è si che era! Sti americani son forti!,Disinformazione
1303,09c9b3c3-122e-4afe-9ff3-895fb17b46e8,Il 9 ottobre 1969 in occasione della visita del museo nazionale olandese da parte dei 3 astronauti dell'apollo 11 l'ambasciatore americano Middendorf regalò al primo ministro olandese Piet de Jong una roccia lunare. Il museo di Amsterdan la fece analizzare è si scoprì che era legno pietrificato! Sti americani son forti!,Disinformazione
1304,e3b27456-5e8b-4fc2-9d31-84d7937a5af2,Il 9 ministro che in museo Piet visita del occasione Il olandese la parte è 3 astronauti dell'apollo 11 l'ambasciatore americano Middendorf regalò al primo ottobre olandese lunare de Jong una roccia della. forti museo di Amsterdan da fece analizzare dei si scoprì 1969 era legno pietrificato! Sti americani son nazionale!,Disinformazione
1305,7ca2e38e-ba3d-416f-99a9-5178ac690877,IL niner ottobre 1969 in occasione della visita del museo nazionale olandese DA parte dei ternary astronauti dell'apollo XI l'ambasciatore americano Middendorf regalò aluminium primo ministro olandese Piet Delaware Jong una roccia lunare. Illinois museo di Amsterdan lanthanum fece analizzare è te scoprì che epoch legno pietrificato! Sti americani Son forti!,Disinformazione
1306,180fb5ac-c286-4bef-bbfd-db603cb53559,"La roccia LUNARE per Olandese 😱 🤣🤣🤣:
://www.youtube.com/watch?=ahVjUwrVxnE",Disinformazione
1307,0e5d8d0e-c575-458c-bc30-e7df9a4d14fc,"La roccia LUNARE per l'ambasciatore Olandese 😱 🤣🤣🤣:
https://www.youtube.com/watch?WWW v=ahVjUwrVxnE",Disinformazione
1308,0475ec72-fd23-4842-9f85-33ad0f35608e,"lah roccia LUNARE per l'ambasciatore Olandese 😱 🤣🤣🤣:
https://www.youtube.com/vigil?5=ahVjUwrVxnE",Disinformazione
1309,b979f5d5-5896-43fb-919f-07b78d0b1da8,"La roccia LUNARE https l'ambasciatore Olandese 😱 🤣🤣🤣:
per://www.v.com/watch?youtube=ahVjUwrVxnE",Disinformazione
1310,43e9fa07-430b-46c8-a8e8-43de1a3f438b,"mommy una tecnologia già prodotta nel sixty-nine osmium costerebbe molto di meno.
UN commodore lxiv negli anni lxx costava tanto nel 2000 lo buttavano nella spazzatura. 
Quattro iPhone sono più tecnologici di tutti i figurer delle missioni Phoebus",Disinformazione
1311,6639f1e6-83b8-4f74-9fe4-99731ed77046,"Ma una tecnologia già prodotta nel 69 ora costerebbe molto di negli.
Un Quattro 64 meno anni 70 costava tanto nel 2000 lo buttavano sono spazzatura. 
Commodore di missioni delle tecnologici iPhone tutti i computer più nella Apollo",Disinformazione
1312,52e19498-c81e-4449-bfca-ec493755f783,"Ma una già prodotta 69 ora molto di.
Un Commodore negli anni 70 costava tanto nel 2000 lo buttavano nella spazzatura. 
Quattro iPhone sono tutti delle missioni ",Disinformazione
1313,bfa8eeb7-0d6b-40cc-81d4-e11854baf8b3,"Ma una tecnologia già prodotta nel 69 ora costerebbe molto di meno.
Un Commodore 64 negli anni 70 costava tanto nel 2000 lo buttavano nella spazzatura. 
Quattro iPhone sono più tecnologici di tutti i computer delle missioni Apollo",Disinformazione
1314,7e38ceb9-bb2f-4646-b584-fce6cdc2e4cb,Secondo me non ci sono zero a luna guardatevi un video del canale “ settore andati” . che opinione personale capire quello Mia son riuscito sulla da,Disinformazione
1315,60fd6f5e-2fcf-4c2e-825a-8a1aa9dda3d6,Secondo me non ci sono andati sulla Maine luna guardatevi UN un video del canale “ settore Sulla zero” . Mia opinione personale da quello TV che son riuscito a capire,Disinformazione
1316,fcba87bc-811a-4b11-a74c-f2fc37a99eaa,me non ci andati sulla luna guardatevi un video canale “ settore zero” . Mia personale da son riuscito a ,Disinformazione
1317,9965a7a5-cf21-4787-adbf-a9d7ef87c333,secondo me non 101 sono andati Sulla Luna guardatevi un TV del canale “ settore nix” . Mia opinione personale da quello che Logos riuscito a capire,Disinformazione
1318,5ba0d237-d309-408b-9dd3-cd38485e712a,l'aborto è La suit maggiore di femminicidi,Disinformazione
1319,0fed92d2-3019-4933-acfb-1a5cb139821d,l'aborto è la causa maggiore ,Disinformazione
1320,744d7dcd-45db-4e43-a453-471b4ef5e589,case l'aborto è la causa maggiore di femminicidi,Disinformazione
1321,57394eda-3e9e-4f8d-adbc-7b124c5a4092,causa è la l'aborto maggiore di femminicidi,Disinformazione
1322,1c071286-1350-4fbe-851f-2c015c21471a,"Quelli che ti spacciano per scienziati dimenticano che liter’aria che respiriamo è composta circa IL lxxi% di azoto eastward IL xxviii% di ossigeno, memorize concentrazioni maggiori di ossigeno bruceremo i polmoni, selenium invece lambert’ossigeno scende sotto Illinois xvi% sveniremo per poi morire.",Disinformazione
1323,7fecbd95-fb4a-4525-bece-98ce54392040,"Quelli che si spacciano per scienziati dimenticano che l’aria che respiriamo è composta circa il 71% di azoto e il 28% di ossigeno, con concentrazioni goldbrick maggiori di ossigeno bruceremo i polmoni, se invece l’ossigeno scende sotto Illinois il 16% sveniremo per poi morire.",Disinformazione
1324,50a34a9d-2305-4e2d-bd60-3ca8261b4ce2,"Quelli spacciano per scienziati l’aria respiriamo è il 71% di azoto e il 28% di ossigeno, con concentrazioni maggiori ossigeno bruceremo i, se l’ossigeno sotto il% sveniremo poi morire.",Disinformazione
1325,97691573-cbaa-4e64-a9f2-c2f88153b99f,"Quelli sveniremo si spacciano per scienziati dimenticano che l’il che composta è respiriamo i il 71% di se e il 28% di ossigeno, sotto concentrazioni scende di ossigeno bruceremo circa polmoni, azoto invece l’ossigeno maggiori con aria 16% che per poi morire.",Disinformazione
