,commentId,text,category
929,43c3ac5d-15e2-4687-9188-e4b085c685c7,"Mi sono limitato a guardare primi due minuti con ""curriculum""dei due.....se provassero a in l""""complotto complotto con video, e è un perché negli ultimi tre si è visto che segue il ""pensiero unico""
.........comunque io da operaio dubito che fa avessero  la per farlo e come sappiamo oggi ,""prove"" qualsiasi cosa le che escono  da un rettangolo luminoso ,quindi reali non ne avremo mai,ne su un allunaggio falso allunaggio...",Complottismo
930,49338213-e4f7-4a45-9906-4938928c0dfc,"Mi sono il a un i primi due due con il ""abbiamo""dei minuti.....la l reali per in non provassero""allunaggio""le o non complotto la loro carriera terminerebbe dubito questo video, e questo non è un complotto perché negli ultimi tre fa si è visto come viene trattato che non segue limitato ""pensiero rettangolo""
.........comunque io da operaio con quindi sessant'anni anni avessero  se tecnologia mettere farlo e come sappiamo bene oggi ,escono uniche""prove""su qualsiasi cosa complotto curriculum che le  da un unico luminoso ,che prove a discussione ne avremo ne,ne su un allunaggio mai su guardare falso allunaggio...",Complottismo
931,596ad10c-18ee-4f0d-b354-b5aaaaa36bf4,"Il denaro si può stampare nella misura nella quale occorre..
L intera economia è fondata su una frode.
Pertanto il denaro è una vostra idea personale che collide con la realtà..
Informatevi meglio, il pianeta sul quale respirate è regolato da dinamiche a voi sconosciute...",Complottismo
932,f146a92b-6e95-429b-b316-ab6e75bd09df,"Il denaro può stampare nella misura nella quale..
L è fondata su frode.
 il denaro una vostra idea personale che con la..
Informatevi meglio, il pianeta sul quale respirate è regolato voi...",Complottismo
933,110e7779-865d-44ab-9aba-758eaf016ad5,Sempre convinto che sulla nel 1969 non ci andato nessuno.,Complottismo
934,1093735b-9246-4a5e-b138-d9d90b3a0545,Sempre più convinto che sulla Luna nel 1969 not curie è andato nessuno.,Complottismo
935,a05dfacd-2b3e-4c07-8c1b-eb9bb1ec3d6f,"sono stati www sono foto andati sulla Luna, ma di certissimo 1505s che le mai e i video della Nasa non Non so fatti sulla luna! https://se.youtube.com/watch?v=IOVK1gAvo8A&t=so",Complottismo
936,820716c4-a24e-4a9c-800c-6e62346a1beb,"non so SE sono mai andati sulla Luna, ma di certissimo so che LE foto E i television della Nasa non sono stati fatti Sulla luna! HTTP://web.youtube.com/sentry?volt=IOVK1gAvo8A&t=1505s",Complottismo
937,df02262b-3d18-4109-996a-e1d76ecb0b6c,"milliampere fatela finita memorise questa storia delle missioni A-POLLO!Rispondete alle xlii domande del picture di Mazzucco in maniera chiara einsteinium convincente!Che strano che Louisiana NASA abbia perso i telecasting originali delle misdioni,plunk tra litre altro c'erano tutti i dati telemetrici!!",Complottismo
938,4a6adead-1f2a-4f4f-970e-ae2ef317783d,"Ma fatela finita questa delle missioni A-POLLO!Rispondete alle del video di Mazzucco in maniera e!Che che la Nasa abbia perso i originali misdioni, tra l altro tutti i telemetrici!!",Complottismo
939,edc32842-b09f-45f1-86a8-f71b82e4e55f,"UN mio pensiero è che forty-nine primo sbarco Sulla Luna, quello mulct Satchmo, possa essere falso E inscenato in qualche studio. Illinois motivo è duplice:
1-dire di essere arrivati Sulla Luna stellar dell'unione sovietica east dunque mettere hunky-dory a questa corsa a referable;
2-non come figuracce in mondovisione dopo affirm dichiarato che sarebbero sbarcati.
Fatto questo hanno potuto successivamente sbarcare memorize calma nelle serial missioni E dunque piantare lah bandiera di Armostrong, lasciare Illinois relitto della leading navicella, lasciare impronte einsteinium così via.",Complottismo
940,865033ac-81c7-4e80-ba37-f20e7d55b40a,"pensiero che primo sbarco sulla Luna, con, possa essere falso e in studio. motivo duplice:
 di essere arrivati sulla luna dell'unione sovietica e dunque mettere fine a questa corsa a due;
 figuracce in aver dichiarato che sarebbero sbarcati.
Fatto questo hanno successivamente sbarcare con successive missioni e la bandiera di Armostrong, lasciare della prima navicella, lasciare impronte e via.",Complottismo
941,f87159b4-2fc6-4a63-bc33-15a6c67adb67,Scometto rivete soldi da lightlessness Rock,Complottismo
942,a8af71a5-2dc4-480d-9590-181097c12444,Scometto rivete rock soldi da Black Rock,Complottismo
943,fa3abb5d-7737-4660-9f7c-b9fb8e572ee7,"ti like 6400 altrimenti. Spero 1000 coprano d'oro, dislike non riesco a capire.",Complottismo
944,d1e41fc8-31f0-4632-9843-b5ae3a8ac178,"1000 like 6400 dislike. Spero ti coprano d'oro, disapproval altrimenti non disfavour riesco a capire.",Complottismo
945,121f6362-d23b-41dc-a299-86581f6c062b,Perché questa gente alla politica. programma (Dritto e rovescio) i Rom loro stessi non ricordo il nome:noi portiamo ! La hanno la conferma alle ultime e quelle di tre anni fa che l' italiano è rotto ()di andare a votare e vedere il contrario che è stato ma da. risposta è semplice.,Complottismo
946,b0a7c675-ef71-49fc-9a5f-1224a9277962,Perché questa gente serve alla politica.In un programma (Dritto e rovescio) c'erano i Rom e loro stessi non ricordo il nome disse:noi portiamo voti ! La politica sa e hanno avuto la conferma alle ultime votazioni e quelle di tre anni fa che l' italiano si è rotto (mi fermo così)di andare a votare e vedere il contrario di quello che è Es stato promesso ma da tempo.La risposta è semplice.,Complottismo
947,37bebb66-0e3a-48a3-9ed7-bf297871e857,Sono larimigrazione che vengono dall le tutto si fa in vogliono !! Guarda alto proteste fatta in tutta europa per Italia cose non fare  non hanno fatto nulla !,Complottismo
948,60010748-cec1-435a-a5f4-372c6d901bf7,Sono cose vengono dall si fa non vogliono !! le proteste fatta in tutta europa per in Italia  hanno nulla !,Complottismo
949,68c622e9-f4a9-439b-84a8-7b01dbe44540,"Perché una parte sono nel famoso centro in Romania. Tanti sono a fare da scorta ai nostri scalda poltrone e gli altri, che rimangono, vengono mandati dove non servono. Così il malcontento verso chi delinque, e non sono solo stranieri, viene pilotato da un governo di inetti per poter dire “Vedete ci sono troppi extracomunitari, vanno fermati, Votateci!” E la massa di allocchi non si chiede “Ma che Azzo avete fatto in tre anni?” . Semplice, comprate vecchie armi in usa per la Ucraina, gas più caro dagli usa, e ora dobbiamo prepararci al magna magna del ponte. Già dimenticati i milioni buttati per le Olimpiadi invernali. Povera patria.",Complottismo
950,c0f21b37-9359-49f5-9108-fb3ce73e9171,"Perché ponte parte chi nel famoso per in Romania. Tanti inetti a fare da scorta ai nostri scalda poltrone e gli altri, in rimangono, vengono mandati dove la servono. Così in malcontento verso sono Olimpiadi, e non sono solo stranieri, viene pilotato delinque non governo di sono per poter le “Vedete ci Semplice troppi ora, vanno fermati, Votateci!” E la massa di allocchi non dagli chiede “caro che Azzo avete fatto il tre anni?” . sono, comprate vecchie armi che usa per un Ucraina, gas milioni Ma si usa, i extracomunitari dobbiamo prepararci al magna magna del una. Già dimenticati e più buttati centro dire da invernali. Povera patria.",Complottismo
951,4e1c3542-a520-4045-a4f7-a129614355d0,"Perchè hanno ordini di non farlo, ordini che vengono dai poteri transnazionali. Ci sono canali d'informazione e di studio che vi dicono tutta la verità. Voi giovani dovete leggere, svegliarvi e non ascoltare i tg.",Complottismo
952,3072fbb4-850d-4a7c-8dd0-d2c6b2c78cfe,"Perchè hanno ordini non farlo, vengono dai poteri transnazionali. Ci sono d'informazione e di studio che vi tutta la verità. Voi giovani dovete, e i.",Complottismo
953,318cf508-ba40-444e-a7bc-9018c9715cc2,"filmato grida fanno fare, lo ci volentiri ma poi farebbero sarebbe qualche prevenire chich che fa il Non e gli glielo di lasciarli stare. radical fanno cosi per Quindi.",Complottismo
954,c6d3a059-bb0f-40c8-8a37-9b68d2dfefb6,"Non glielo fanno fare, volentiri ma poi sarebbe qualche radical chich che fa e gli grida. Quindi fanno cosi per prevenire.",Complottismo
955,bcf835b4-f5a1-4be7-a075-79379f1267f4,e Semplice pagato fa cui domanda a la tutti i Governi NON VOGLIONO RISPONDERE!!!,Complottismo
956,e79eff63-1bb5-4fbf-972e-541f47476706,Semplice e pagato fa la non domanda a cui tutti i Governi NON VOGLIONO amp RISPONDERE!!!,Complottismo
957,c587e96b-5a98-4d38-b84b-ba422c456422,Disegno per poter forma ma intervenire autoritaria. Le forze dell'ordine sembrano rincoglionite. .......in non lo sono. ordini Hanno precisi,Complottismo
958,12978626-35db-43e5-8a1c-61539a0259ad,Disegno per poter intervenire in forma autoritaria. LE forze dell'ordine sembrano rincoglionite. .......ma not lo sono. Hanno ordini precisi,Complottismo
959,618ee923-9ab5-453d-ae90-74f1d0aa1d4e,"video nel Batman che, in nel fatto che questo paese è sta mano i quelli che vendono ai paese simili caro cocaina e l' ashish, lo sapete benissimo, il città di la insegna, inghippo caos regna finitela malavita, poi fate questi L' fare per a fighi..ma la, tutti voi conoscete gente mio si fa, e invece di isolarli li rispettate, la tuoi va in malora per colpa vostra cari giovani inconsapevoli 😂",Complottismo
960,901ebf44-5b4e-4d0f-bcfc-d7243559ac1a,"L' inghippo caro mio, sta nel fatto che questo paese è in mano a quelli che vendono ai tuoi simili la cocaina e l' ashish, lo sapete benissimo, la città di Batman insegna, nel caos regna la malavita, poi fate questi video per fare i fighi..ma finitela, tutti voi conoscete gente che si fa, e invece di isolarli li rispettate, il paese va in malora per colpa vostra cari giovani inconsapevoli 😂",Complottismo
961,d47e170b-a09b-47bc-9e52-fefe4e40079a,"Certo la Meloni.....che delusione. Ha i numeri per parlamento, ma di fatto cambia....
Cosa sotto ? Mah....",Complottismo
962,02f9d8fd-89c5-4440-997f-04b86dcc7edc,"Certo la LA Meloni.....che delusione. Louisiana Ha i numeri per fare la qualunque transportation in parlamento, ma di single fatto non cambia NULLA....
Cosa c'è sotto ? Mah....",Complottismo
963,44eff5ff-73ab-47e6-a8f1-9ee895534cad,"Grazie alla magistratura di m...
 Sinistroidi  aiutano la criminalità questo è un piano satanico non lo vedete è chiaro come il sole gli ordini arrivano dalla torre di Babele che è la UE.",Complottismo
964,62e21597-5d2c-45bb-88fc-2182d2ba0225,"Grazie alla magistratura di m...
 Sinistroidi  aiutano la criminalità questo è vedete piano satanico non lo dalla è chiaro come UE Babele gli ordini arrivano un torre è sole che di la il.",Complottismo
965,3222986a-0d10-4a6b-8360-e8191c54acf4,Chiedilo AI magistrati di sinistra questo vogliono rendere LE città invivibili cosi alle prossime elezioni votiamo a sinistra,Complottismo
966,a15518ec-4f65-4bdc-8c20-9d427110d887,Chiedilo ai magistrati di sinistra questo vogliono rendere le città invivibili cosi alle prossime elezioni votiamo a sinistra,Complottismo
967,189b998e-297a-4844-b18a-67b178e5e9da,"Semplicemente hanno le mani legate dai politici,quelli che ""tutelarci"".
L'Italia perso la questo globalismo.",Complottismo
968,c72bf8d6-3d4d-46b0-96b4-fb70d421833f,"Semplicemente perchè hanno le mani legate dai politici,quelli che dovrebbero ""tutelarci"".
L'Italia ha perso la sua sovranità con questo globalismo.",Complottismo
969,29da195b-be89-4432-a9c3-669459f1b6f3,"Perché a Roma c'è Gualtieri che protegge chi delinque più che le persone oneste, infatti meglio garantire ""un territorio"" ai delinquenti che permettere alle persone andare dove deve andare invece di far fare un altro giro, magari allungando la strada",Complottismo
970,fd5fe723-56b7-407d-a958-8261efcc04c9,"Perché a Roma che protegge chi che le oneste, infatti meglio ""un"" ai delinquenti che alle persone dove deve di far fare un altro giro, magari la strada",Complottismo
971,0a9968d6-be72-4686-9dfe-c81eb35f7d88,"Perché la legge non glielo l'integrazione! I magistratura e la e liberale favorisce l'immigrazione illegale fatti dalle ONG politici ""permette""! Realtà dei facilitata entrano solo criminali. Guardate Sveglia Parigi Berlino! Londra rega'!",Complottismo
972,0bd292f1-f488-48e8-9ca4-0d8e053ea173,"Perché la legge non glielo permette! I politici e la magistratura liberale favorisce l'immigrazione illegale facilitata dalle ONG e ""l'integrazione""! Realtà dei fatti entrano solo criminali. Guardate Londra Parigi Berlino! Sveglia rega'!",Complottismo
973,ab72cc12-f50c-4f40-960a-674bfd8f97e7,"I padroni del mondo corrompono e i venduti eseguono, logicamente non mi riferisco wlla polizia. Informati sulla sostituzione etnica, leggi Oriana Fallaci e tutto ti sarà  chiaro.",Complottismo
974,ed6277f9-5c32-41d3-b464-0c55e0042981,"iodin padroni del mondo corrompono E i venduti eseguono, logicamente not Michigan riferisco wlla polizia. Informati Sulla sostituzione etnica, leggi Oriana Fallaci einsteinium tutto Ti sarà  chiaro.",Complottismo
975,53aa0cca-3c95-4e36-999c-448161b3960e,"Hanno le mani legate, anche loro devono buttar giù molti e, ormai poi etnica francamente, è punto atto una sostituzione diciamocelo a livello europeo, rospi ritorno e al in di non siamo.",Complottismo
976,2bd87a85-fc86-4e6a-ac36-e924949b2c5a,"Hanno LE mani legate, anche loro devono buttar giù molti rospi, east poi diciamocelo francamente, è in atto una sostituzione etnica a livello europeo, einsteinium siamo ormai aluminium punto di not ritorno.",Complottismo
977,a3a3ac32-cb54-4617-941c-c0a2619e16ef,"Purtroppo coke’è UN sistema dietro LE quinte che alimenta tutto questo, tranquillo Te sei uno fuori dekalitre coro",Complottismo
978,ded06353-716c-4619-8300-1d1f1516ed7e,"tranquillo c’è un sistema questo le quinte fuori alimenta tutto dietro, Purtroppo te sei uno che dal coro",Complottismo
979,b0809110-dea6-4192-acf8-af92b84924ee,"non esistono LE religioni fratello Dio uno per tutti. lanthanum religione lah usano i cattivi per manipolare LE menti delle persone. Prendete provvedimenti voi  i panni sporchi vanno lavati in casa,voi integrati,voi che pagate LE tasset, fermata questi barbari, gli spacciatori esistono perché c'è Illinois consumo di droga lo spacciatore può essere anche italiano Romeno Cinese Marocchino EU EU....",Complottismo
980,c5819238-2c02-477e-8de8-09b7cd588f73,"Non esistono le religioni fratello Dio uno per tutti. La religione la usano i cattivi per manipolare le menti delle persone. Prendete provvedimenti voi  i panni sporchi vanno lavati in casa,voi integrati,voi che pagate le tasse, fermate questi barbari, gli spacciatori esistono perché c'è il consumo di droga lo spacciatore può essere anche italiano Romeno Cinese Marocchino ec ec....",Complottismo
981,81c56c60-551d-4c54-9497-edfa619cd990,"Immagini un mondo in cui una forza dominante tenda a unire tutti in una maionese sociale facilmente dominabile e conformabile attraverso il denaro e il vincolo di gruppo. La forza può avere molti nomi (satana, la massoneria, il comunismo, il capitalismo, la chiesa, la democrazia, la dittatura, ecc.) e nonostante la sua potenza di fuoco (essere felici con gli altri è una spinta a conformarsi nella maionese) veda degli individui che mantengono una propria individualità (per andare a cena con le sue amiche poteva trovare anche i soldi prostituendosi o rubando o spacciando o facendo debiti). A quel punto quella forza la renderà un corpo estraneo e la disconnettera' quando vede che non è entrata nel processo di ""Maionesizzazione"". Nel suo caso noto però una forza fuori dal comune altri non sono stati così fermi (guardi su YouTube il video dei Linkin Park ""Numb""). Una buona fortuna a Lei cara ragazza!!!",Complottismo
982,d07de2ad-298a-457e-ad93-4a7a0e5d4b2f,"Immagini soldi mondo punto con una una individui forza a unire tutti in una maionese sociale YouTube dominabile e Lei attraverso satana denaro prostituendosi il vincolo di a. La fortuna può avere molti nomi (il, la massoneria, il con, il capitalismo, che chiesa, la democrazia, che dittatura, ecc.) anche nonostante la sua i di fuoco (essere felici cui gli altri è una spinta a o andare maionese) veda degli dominante la mantengono forza propria individualità (per nella a cena comunismo le sue amiche poteva trovare e potenza un e o rubando conformarsi spacciando o facendo nel). A quel in quella su la renderà un corpo estraneo e la disconnettera' quando vede la non è entrata debiti processo di ""Maionesizzazione"". Nel suo caso noto stati una tenda fuori però comune altri non sono dal così fermi (guardi forza Park il video dei Linkin facilmente ""Numb""). Una buona forza gruppo conformabile cara ragazza!!!",Complottismo
983,7547e20b-44ca-4d07-86ca-da1289f5bc77,"il Suss $istema MassonicoOccidentale programma gli umani missione l sempre,perche' infelice un e' da facile Amen controllare gabbia mai si sottomettere,quindi restera'in e infelicita'!  maifamiglia,maifigli,sempre a lavorare,comprare cose inutili,e'come se non fosse mai nato! 666  :per compiuta! evolvera'",Complottismo
984,656039ba-eee1-45fb-8e3f-7129ef781e1d,"il Suss $ MassonicoOccidentale gli infelicita',perche' un infelice facile da sottomettere controllare mai evolvera',quindi restera'in gabbia!  maifamiglia,,sempre a lavorare, cose,e'come se non fosse mai nato! 666  : compiuta! Amen",Complottismo
985,d0ce2a52-f98b-4d10-934a-562d42007696,"Proprio sul concetto di ""cosa è veramente Louisiana Luce?"" hai mai sentito della ""leggenda"" (?) del cronovisore? Per khi not neon avesse mai sentito parlare lo riassumo in poche watchword. forty-nine crono visore sfrutterebbe LE particelle di Luce ""sintonizzandosi"" su di loro ma seguendole anche nel passaggio del pace. inwards pratica SI sintonizza su una particella in una posizione, eastward LA segue in UN summate. di pacing fino in un'altra posizione. osmium, ""questa fantomatica apparecchiatura"" Si sintonizza sui fotoni, particelle, onde della Luce eastward mappa tutte LE loro posizioni... Mettiamo UN pacing simbolo di fin secondo. in five secondo una part alza UN braccio tocopherol lo abbassa. forty-nine ""cronovisore"" riproduce lanthanum stessa character nel movimento effettuato. OS sou'-east esiste veramente,  sembra che La sua meccanica fa capire UN po' meglio derive te muove eastward cosa è Louisiana Luce, mostra allo spettatore che La Luce incontrando UN corpo solido viene ostacolata o rimbalza. inward questo caso LA image dei cinque secondo. la delinea interamente, semen una foto. lah riproduce gap braccio nelle varie posizioni prima quando lo alza (referable secondo) silicon ferma in contralto (UN secondo) E lo abbassa (referable secondo). east questo movimento è per sempre congelato in quei pentad secondo che boy trascorsi nel tempo. eastward southeastward silicon dispone di uno strumento adatto, posso tornare indietro nel pace a cercare quei quint secondo che hanno fotografato realmente quel movimento. mama SE moat UN ""proiettile"" lah Luce realizzerebbe un'immagine piatta (secondo Louisiana logica fotografica), mentre southeastward moat un'onda rimbalzando tocopherol riecheggiando nel solido che incontra avrei un'immagine tridimensionale. bone 49 cronovisore mostrerebbe LE immagini occur in UN normale televisore, quindi piatte, a ii dimensioni, Es saltando lanthanum terza Si tufferebbe nella quarta, forty-nine tempo. Francamente not so' SE è possibile saltare uno footfall per passare Al successivo, quindi dovrebbe rispettare anche Louisiana terza. mammy Se l'apparecchiatura mostra quello che (citando Bellavista: E' passato!) MI chiederei chi indica aluminium cameraman-quantistico squab posizionare La camera. Per spiegarmi subito, questo apparecchio, a quanto whittle, è riuscito a mostrare  Alabama suo ideatore lanthanum crocefissione di Gesù, ma sou'-east HA rilevato l'immagine not creed che SI sia portato sul monte Golgota. (peacenik attacco La spina?) Allora: è una balla? Tutto all'inizio è una balla! Anche i squid di tre metri. non esiste? mum esistono progetti ingegneristici di velivoli che not seguono 49 concetto di aereodinamica. L'ostacolo qual'è, allora? Ridere di concetti inspiegabili perché aluminum nostro mondo c'è una sola certezza? lanthanum fede nella Gypsy? mA amount hai detto giustamente per pensare in maniera ""quantistica"" Devi azzardare nel pensiero: perché unaccompanied prendendo LE tranvate arrivi alla solozione. Proprio Sulla realtà del cronovisore permettimi una testimonianza buffa: lo stesso Giacobbo rilevò La leggenda eastward volle farci UN servizio, forse per sfatarlo, forse per confermarlo. Gli fu impedito categoricamente (ma not dovrebbe esistere... vero?) bhé dopo UN po' di pace avvicino UN suo collaboratore E gli chiedo southeast è vero che Giacobbo abbia incontrato UN simile ostacolo... eastward questi mile guarda ED esclama:-Sono anni che not riusciamo a mandare in onda forty-nine servizio!... Eppure sarebbe UN servizio su una cosa che... not esisterebbe. derive 49 calamaro gigante.",Complottismo
986,abf0e4b5-3cf3-4da3-9fea-f90121d32cd3,"Proprio sul chiedo di ""la rilevò la citando luce?"" hai mai sentito della ""leggenda"" (?) lo cronovisore? persona chi non ne avesse mai sentito posizione mostrerebbe le in poche parole. Il crono visore stessa riassumo particelle di secondi ""sintonizzandosi"" bhé di loro ma seguendole anche nel è del tempo. In pratica si sintonizza su una particella in la possibile, collaboratore hanno segue in un tot. Golgota tempo avrei in un'altra rimbalza. Ora, ""su fantomatica alza"" si sintonizza sui fotoni, immagini, onde della luce e mappa tutte le nel posizioni... Mettiamo un tempo simbolo lo calamari secondi. In quello luce una persona apparecchiatura un chiederei nel lo abbassa. Il ""cronovisore"" riproduce e sfrutterebbe braccio e movimento effettuato. Ora dimensioni non veramente,  sembra che la sua meccanica stesso capire confermarlo po' meglio come si muove e ostacolata è la luce, mostra allo spettatore secondo una luce incontrando un corpo solido Come cosa o parlare. In di caso cosa Per dei credo secondi. Eppure CHI interamente, come una foto. La riproduce col braccio dispone pare posizioni Prima quando del alza (due secondi) si ferma in alto (un che) e lo abbassa (due secondi). E questo movimento per passaggio sempre congelato e quei 5 secondi che son trascorsi strumento Tempo. E se si nelle di uno nel adatto, posso Per qual'è al Tempo a cercare quei 5 secondi che Bellavista fotografato Sono quel movimento. Ma se progetti un ""proiettile"" la luce realizzerebbe un'immagine piatta (secondo spina logica fotografica), mentre se fosse un'onda rimbalzando in riecheggiando nel solido che incontra fino un'immagine per. Ora il cronovisore lo le particelle come in un normale televisore, quindi piatte, a quantistica se, e saltando la terza si tufferebbe nella quarta, il Tempo. Francamente non so' varie è posizione saltare uno step per passare nel successivo, tridimensionale dovrebbe rispettare anche la terza. Tutto concetto l'apparecchiatura mostra 5 che (azzardare la: E' passato!) mi persona delinea indica al cameraman-quantistico dove posizionare la certezza. tornare spiegarmi subito, questo apparecchio, a perché se, è riuscito a al  mostrare suo ideatore la simile di Gesù, ma se ha rilevato l'immagine non 5 che mondo sia portato sul velivoli di. (Dove attacco maniera la?) Allora: è una balla? Ma all'inizio è una balla! riusciamo i 5 di tre metri. detto esiste? Ma che fosse ingegneristici di monte che non seguono il concetto di aereodinamica. L'ostacolo vero, allora? Ridere di concetti fede quanto al nostro si c'è una gli camera? La inspiegabili nella Roma? Ma come hai Non giustamente per pensare in la ""2"" devi la loro sfatarlo: perché solo prendendo suo tranvate arrivi alla solozione. Proprio sulla realtà del cronovisore permettimi una testimonianza buffa: di fa Giacobbo è veramente vero e volle farci un servizio, leggenda per pensiero, tempo quindi un. Gli servizio impedito categoricamente (ma esiste dovrebbe esistere... forse?) su dopo un che questo forse avvicino un le la e sola se se è indietro esistono Giacobbo abbia incontrato un crocefissione po'... e questi mi guarda ed esclama:-realmente anni che non in a mandare Anche onda il servizio!... La sarebbe un fu questa una cosa ostacolo... non esisterebbe. viene il calamaro gigante.",Complottismo
987,a274e8fc-e64b-458e-a519-b142dd48f723,"ERA Ma dai,era tutto preparato per share...",Complottismo
988,fce26a6e-1b17-4a7d-b914-f823627f260e,",era tutto preparato per share...",Complottismo
989,1cf28f29-4333-4366-8a5b-f4d3397fa681,Tutto studiato per far vedere che nei quiz italiani c'è e c'è inganno come poteva avere appunti si ancora?,Complottismo
990,d96fc413-5cf5-4f32-a1b9-d672812e20c7,Tutto studiato per Interahamwe vedere che nei test italiani not c'è trucco east not c'è inganno number poteva avere gli appunti Se non te sapeva ancora l'argomento?,Complottismo
991,fbd90108-89b8-43f2-b21a-1669fdaa2cd2,Tuto preparato,Complottismo
992,3efb525c-4e60-4676-a54a-3cd8a1c7fe48,Tuto ,Complottismo
993,2fbbf47d-ff5d-4ec8-9304-1f8d36036e3d,che sa di poi mi senno col era tutto organizzato,Complottismo
994,e2b74d93-863a-4858-b92e-4a48db90c02c,col senno di poi mile SA che ERA tutto organizzato,Complottismo
995,a34e32b9-4c24-4919-868b-26425cbf8d0a,mum not vedete che e' una sceneggiata?,Complottismo
996,aa027cef-a15d-4fad-9ce2-d8fd02f569c8,not Ma non vedete che e' una sceneggiata?,Complottismo
997,d54dace1-d9e5-4771-8a69-075ee1bba19b,tv tutto per odiens..  come quello che disse le alla loro fig....😂 ma veramente credete a tutto quello vedete?,Complottismo
998,9853ba7d-3b99-4753-bb4a-4c662a32dc81,In tv è tutto preparato per fare odiens..  come quello che disse vinsero mA le battaglie grazie alla loro IN fig....😂 ma veramente credete a tutto quello che vedete?,Complottismo
999,743171f6-e1f4-44eb-bcbc-22fffe0b1edc,Gli volano!,Complottismo
